{"mode":"production","profile":"aws_managed","database":{"urlRef":{"provider":"aws_secrets_manager","name":"amos/prod/database-url"}},"providers":{"aws":{"state":"required","credentialRef":"env://AWS_WEB_IDENTITY_TOKEN_FILE"},"cloudflare":{"state":"required","credentialRef":{"provider":"cloudflare_secret_store","name":"dns-token"},"proxyMode":"dns_only"},"email":{"state":"required","credentialRef":"env://EMAIL_PROVIDER_KEY"},"payments":{"state":"required","credentialRef":"env://PAYMENTS_PROVIDER_KEY"},"identity":{"state":"required","credentialRef":"env://IDENTITY_PROVIDER_KEY"}}}
