{"mode":"development","profile":"aws_vm","database":{"urlRef":"env://AMOS_DATABASE_URL"},"providers":{"aws":{"state":"disabled"},"cloudflare":{"state":"required","credentialRef":"env://CLOUDFLARE_LOCAL_TOKEN"},"email":{"state":"disabled"},"payments":{"state":"disabled"},"identity":{"state":"disabled"}},"development":{"localOnly":true,"bindAddress":"localhost"}}
