{"mode":"development","profile":"aws_vm","database":{"urlRef":"env://AMOS_DATABASE_URL"},"providers":{"aws":{"state":"disabled"},"cloudflare":{"state":"disabled"},"email":{"state":"disabled"},"payments":{"state":"disabled"},"identity":{"state":"disabled"}},"development":{"localOnly":true,"bindAddress":"127.0.0.1"}}
