{"mode":"production","profile":"aws_vm","database":{"urlRef":"postgres://admin:example-secret@db.invalid/amos"},"providers":{"aws":{"state":"required","credentialRef":"literal-access-token"},"cloudflare":{"state":"required","credentialRef":"env://CLOUDFLARE_API_TOKEN","proxyMode":"dns_only"},"email":{"state":"disabled"},"payments":{"state":"disabled"},"identity":{"state":"disabled"}}}
