{"mode":"production","profile":"aws_vm","database":{"urlRef":"env://AMOS_DATABASE_URL"},"providers":{"aws":{"state":"required"},"cloudflare":{"state":"required","credentialRef":"env://CLOUDFLARE_API_TOKEN","proxyMode":"dns_only"},"email":{"state":"disabled"},"payments":{"state":"disabled"},"identity":{"state":"disabled"}}}
